Item type|ENTRYTYPE|ID|Authors|Title|Journal|quartil|hindex|Publication year|Volume|Issue|Pages|Publisher|Address|Date published|ISBN|ISBN (alt.)|ISSN|URLs|DOI|Abstract|Keywords|Notes|Affiliation|Language|Pages cited
Journal Article|article|78|Shapenko A,Martynov S|Abrau-Durso: reviving the 140-year-old Russian wine brand|Emerald Emerging Markets Case Studies|Q4|7|2020|10|2|1-23|Emerald Group Publishing Ltd.||2020|||2045-0621|http://dx.doi.org/10.1108/EEMCS-06-2019-0156|10.1108/EEMCS-06-2019-0156|Learning outcomes: The learning outcomes of this study are as follows: investigate a story of growth in a volatile emerging market environment; and discuss strategy development in a stagnating, highly competitive market. Case overview/synopsis: In October 2017, Pavel Titov, the owner and Chairman of the Board of Directors of Abrau-Durso Group, assigned a large international consulting firm to assist him in the development of a new corporate strategy. It was 11 years since the Titov family had taken over the then-struggling iconic sparkling wine manufacturer. The Titovs invested heavily into the enterprise with the dream of reviving the century- old brand, and turned the company around: in 2017, Abrau-Durso was the No. 1 sparkling wine brand in the Russian market. However, the shareholders wanted the company to grow further and believed that it was possible to generate more value. How could the company continue growing and increase its value at a time when the wine market was stagnating and the Russian economy was going through a rough period? Complexity academic level: Masters level (MBA, Executive MBA). Supplementary materials: Teaching Notes are available for educators only. Subject code: CSS: 11: Strategy. © 2020, Emerald Publishing Limited.||cited By 1|Moscow School of Management Skolkovo, Skolkovo, Russian Federation|Spanish|
Journal Article|article|79|Dogar MN|Breach of psychological contract: impact on workforce motivation and organizational sustainability|Emerald Emerging Markets Case Studies|Q4|7|2019|9|4|1-20|Emerald Group Publishing Ltd.||2019|||2045-0621|http://dx.doi.org/10.1108/EEMCS-01-2019-0005|10.1108/EEMCS-01-2019-0005|Learning outcomes: This case study aims to expect the following learning outcomes. A better understanding of the nature of a psychological contract being developed by employees in non-profit organizations, especially working in the areas of social development and the impact of this contract on employee commitment. Enhanced understanding of conflict of interest (personal versus public) in social development organizations and its implications. Identification of issues of task conflict versus interpersonal conflict and its impact on organizational functions. Identification of dynamics of exclusion of internal stakeholders from organizational strategic decision-making process along with its impact on organizational performance and sustainability. Devising a mechanism to avoid such conflicts in social development organizations, in particular, and organizations in general. Case overview/synopsis: This case highlights five issues as follows: it identifies and discusses conflict of interest between privileged class possessing decision-making positions in the board of directors and implementers working at the grassroots level at ANMOL (a non-governmental organization working for poor girls education in Baluchistan-hub of China–Pakistan Economic Corridor); it discusses the basis for formulation of psychological contracts and impact of its violation on stakeholder’s commitment and motivation; it discusses the implications of difference of opinion of both stakeholders regarding organizational vision and possible drawbacks of converting task conflict into interpersonal conflict on individuals, organization and end-users; it explores implications of exclusion of key stakeholders from organizational decision-making and its impact on organizational smooth working and sustainability; and it suggests a mechanism to avoid conversion of task conflict into interpersonal conflict and smooth functioning of an organization. Hence, this case discusses theories of conflict of interest between top-leadership and workforce, psychological contract and implications of its breach on employee motivation and organizational sustainability in the context of social development organizations. Complexity academic level: This case provides sufficient material to be discussed at master level courses (management sciences – master of business administration (MBA) level) such as human resource management (dynamics of psychological contract and conflict resolution), leadership and change management in social development organizations (social enterprises). Supplementary materials: Teaching Notes are available for educators only. Please contact your library to gain login details or email support@emeraldinsight.com to request teaching notes. Subject code: CSS 7: Management Science. © 2019, Emerald Publishing Limited.||cited By 1|UCP Business School, University of Central Punjab, Lahore, Pakistan|English|
Journal Article|article|80|Boyar LB,Davis-Friday P|Assessing a golden opportunity: CEO performance at McDonald’s|CASE Journal|Q4|3|2019|15|5|397-415|Emerald Group Holdings Ltd.||2019|||1544-9106|http://dx.doi.org/10.1108/TCJ-12-2017-0118|10.1108/TCJ-12-2017-0118|Theoretical basis: Financial accounting to assess stewardship: the case requires students to evaluate Thompson’s stewardship of McDonald’s, in part based on the company’s financial accounting information. Financial reporting performs an important societal role by helping control agency problems that arise from the separation of ownership and management. Since external stakeholders cannot “observe directly the extent and quality of managerial effort on their behalf […] the manager may be tempted to shirk […] blaming any deterioration of firm performance on factors beyond his/her control” (Scott, 2014, p. 23). However, although financial reporting helps hold managers accountable to shareholders, accounting information is not fully informative about managerial effort. For example, while net income provides useful information regarding the CEO’s stewardship, it is also “noisy,” due to recognition lags and other factors (Scott, 2014, p. 364). Efforts undertaken by Thompson in a particular period, such as marketing expenditures, might reduce current earnings, yet boost future profitability. Additionally, Thompson’s predecessor’s past efforts might have positive or negative effects on current earnings. Evaluating stewardship effectively involves considerable judgment, in addition to knowledge of financial accounting. The implication of poor firm performance is that the CEO is ineffective at formulating and implementing strategies and policies to enhance firm value (Dikolli et al., 2014). Specifically, it appears that missing earnings benchmarks matter more for relatively inexperienced CEOs. Don Thompson’s tenure of 33 months at McDonalds is 42 percent lower than median CEO tenure documented in academic research, where the median tenure of chief executives documented in large sample empirical studies is about 57 months (Dikolli et al., 2014). The evidence suggests that the longer a CEO serves, the less likely he is to be dismissed for performance-related reasons. This appears to be the result of the resolution of uncertainty about CEO’s ability and leads to subsequent declines in the level of monitoring by the Board of Directors. Performance evaluation and bias: a significant body of research explores the extent to which female managers are assessed differently than their male counterparts (Powell and Butterfield, 2002). For example, female CEOs face more threats from activist investors than male CEOs. Therefore, even after women achieve the highest managerial rank, they experience more professional challenges than their male counterparts (Gupta et al., 2018). However, the question of whether black CEOs are assessed differently is more challenging to answer empirically as a result of a smaller sample size (only one percent of S&P 500 companies are run by black CEOs). Our case attempts to develop the inference that if female CEOs are subject to bias, analogous forces are likely at work when black CEOs are assessed. Recent evidence further suggests that business students sometimes demonstrate bias in making assessments (Mengel et al., 2018). The authors discuss these findings – as well as strategies for including them in the case discussion – in the “Teaching Strategy” section herein below. Research methodology: The case was written from the public record surrounding the appointment of Don Thompson and McDonald’s company filings. The record includes articles from The New York Times and The Wall Street Journal, as well as local and industry publications. Case overview/synopsis: The case examines the role of financial accounting in evaluating CEO performance in the context of the appointment of McDonald’s first African-American chief executive and his subsequent two-and-a-half years on the job. The case deepens students’ understanding of the link between financial reporting and stewardship, while highlighting the subjectivity inherent in assessing managerial performance, particularly over relatively short time periods. As students analyze the case, they must consider the extent to which a firm’s results are attributable to luck vs skill. We use “skill” to refer to CEO effort and other controllable factors, while “luck” refers to exogenous factors, such as macroeconomic conditions. Assessing stewardship is of practical significance. It allows pay to be better aligned with performance and empowers stakeholders to identify when a change of leadership may be warranted. The case may also be used to spur reflection, in an applied context, on the importance of being alert to unconscious bias, even when evaluating seemingly objective financial reporting data. Recent research, discussed herein, suggests that business students sometimes exhibit bias when making assessments. Complexity academic level: The case should be included in discussions of corporate governance, executive compensation and the role of accounting information in efficient contracting. It is appropriate in intermediate financial accounting courses for undergraduates, introductory graduate accounting courses, or other courses with an element of financial statement analysis. Standard introductory accounting textbooks offer helpful supplementary reading for students. Horngren et al.’s (2014) book, Introduction to Financial Accounting (12th ed.), Pearson, London, provides an overview of the income statement and its role in assessing performance (see Chapter 2) as well as a useful discussion on evaluating the components and trends of a business (see Chapter 12). More advanced students may benefit from the in- depth discussion of earnings quality, operating income and non-operating income found in Chapter 4 of Intermediate Accounting (9th ed.), McGraw Hill Education, New York by Spiceland et al. (2018). © 2019, Emerald Publishing Limited.||cited By 1|Department of Business and Technology, LaGuardia Community College, Long Island City, NY, United States; Zicklin School of Business, Baruch College, New York, NY, United States|English|
Book|article|81|De Oliveira FL,Ramos L|In-house counsels in Brazil: Careers, professional profiles, and new roles||#N/A|#N/A|2018||||Cambridge University Press||2018|9,78132E+12|9,78111E+12||http://dx.doi.org/10.1017/9781316871959.004|10.1017/9781316871959.004|INTRODUCTION The title “in-house counsel movement” has been used since the end of the 1980s to describe what began as an American phenomenon entailing the numeric growth, increased prestige, and growing professional value afforded to lawyers working within company legal departments on the company’s legal matters (Rosen 1989; Wilkins 2012). Rosen focuses on how corporate lawyers went from being “kept” counsel in the 1920s, to “tame lawyers” in the 1950s, to “in-house counsel” in the 1980s. Nor was Rosen alone in marking this transition. Beginning in the mid-1980s, scholars studying the legal profession began to note that inside legal departments, and the legal executives leading them, were increasingly valued within their companies and the legal profession as a whole. Chayes and Chayes write: Not only have [in-house counsel] offices grown in size, but in importance as well. The general counsel sits close to the top of the corporate hierarchy as a member of senior management. There is a comparable increase in the importance and complexity of matters dealt with internally. (Chayes and Chayes 1985, 277) Indeed, Chayes and Chayes found that legal directors in large US corporations were gaining relevance within internal corporate hierarchies as they began taking part in the strategic decision-making process of the company. Many were being integrated into higher levels in the corporate hierarchy as members of management, with some even being included on the company’s board of directors (Coates et al. 2011). Early studies of the changing role of in-house counsel also showed that there was a trend to begin carrying out new types of legal services and implementing new methods when managing conflict. For instance, legal departments began performing new activities, such as preventive legal consulting by foreseeing potential conflicts by implementing long- term planning and establishing managing plans for litigation as well as managing legal services by outsourced law firms (Chayes and Chayes 1985, 200). In the almost three decades since this initial work, David B. Wilkins has argued that this the trend of enhancing the value of in-house counsels in the United States and around the world is not over (Wilkins 2012). More specifically, he argues that the prestige of in-house counsel and, in particularly GCs, continues to rise. He notes, that in-house counsel increasingly interact with top company executives, including the board, when advising and solving legal needs in their companies. © Cambridge University Press 2018.||cited By 1|Universidade Federal de São Carlos, Brazil; Escola de Direito de São Paulo da Fundação Getúlio Vargas, São Paulo, Brazil|English|74-109
Journal Article|article|82|Ginevri AS|Staggered boards, banks and public companies: Quo vadis?|European Business Law Review|Q2|6|2017|28|4|575-591|Wolters Kluwer (UK) Ltd.||2017|||0959-6941|||"This Article provides a legal overview and analysis of the benefits associated with the adoption of a staggered board of directors by Italian banks and public companies. While there is a widespread opposition to staggered boards among U.S. scholars and investors - being such device a powerful antitakeover measure in the American legal system since directors belonging to a U.S. staggered board may be removed only ""for cause"" - this Article explains the reasons why staggered boards should be implemented by Italian banks and public companies considering the significant distinctions between the U.S. and the European legal frameworks in this area. Taking into account the new banking governance principles recently introduced by CRD IV and by its implementing measures, this Article explains how the establishment of staggered boards by Italian credit institutions and listed companies may allow them (i) to exclude the risk of potential discontinuities in the management's action, which are inappropriate in corporations of such complexity and systemic relevance, (ii) to facilitate the initial induction and training of the newly appointed directors and officers, who would benefit from the expertise of other members of the board with longer experience, (iii) to strengthen and foster the institutional dialogue between the board and the shareholders, aimed at achieving an adequate collective knowledge, skills and experience of the management body, and finally (iv) to attract more capital from professional investors, granting them the possibility to appoint their representatives in the board on an annual basis."||cited By 1|LINK Campus University of Rome, Italy|English|
Journal Article|article|83|Oppenheimer PH|Legal and accounting issues of manipulating the timing of stock option grants|Journal of Financial Crime|Q2|29|2011|18|1|63-75|||2011|||1359-0790|http://dx.doi.org/10.1108/13590791111098807|10.1108/13590791111098807|Purpose Many corporate managers, with the aid of the board of directors, discovered that they could provide themselves with guaranteed or excessive compensation by manipulating the terms of stock option grants that were included in their compensation packages. This paper seeks to examine the legal, tax, and accounting issues that have evolved because of these suspect illegal activities. Design/methodology/approach The author presents the theory behind performance-based compensation that is the basis for employee stock option grants. The author then examines regulations, judicial theory, and court cases to determine the current legal status of backdating, spring loading, or bullet dodging of executive stock option grants. Findings The current legal environment has made it difficult for executives to continue the practice of manipulating stock option grants without falling under the ire of regulators and shareholders. However, a question remains whether executives that manipulated stock option grants in the past will be found criminally liable for their acts. Practical implications The paper's review of the discourse on the legality of corporate executives enhancing their compensation packages shows the complexity of detecting and regulating this type of suspect activity. Originality/value This paper presents a contemporaneous discussion and data on legal and regulatory changes that resulted from management malfeasance of executive compensation. © Copyright - 2011 Emerald Group Publishing Limited. All rights reserved.||cited By 1|Mike Cottrell School of Business, North Georgia College, State University, Dahlonega, GA, United States|English|
Journal Article|article|84|Guerra S,Fischmann A,Machado Filho CA|An agenda for board research|Corporate Ownership and Control|Not yet assigned quartile|24|2009|6|3 B CONT. 1|196-202|Virtus Interpress||2009|||1727-9232|||Scholarly investigations on the board of directors, although intense from the mid-1990s onward, did not lead to entirely convincing results. This study proposes discussion on building a multidisciplinary and integrated theoretical framework able to capture the complexity and distinctive dimensions of the board as a group decision-making process. This is achieved through an essay developed from analytical and descriptive review of the literature. A synthesis on board research is presented, aiming to understand theoretical models lenses used to study corporate governance issues. The strengths and weaknesses of these models are pointed out, and their influence on board investigation is observed. This essay concludes by proposing a research agenda that considers the addition of psychological and sociological approaches to economic models of the analysis of group decision-making.||cited By 1|University of São Paulo, School of Economics, Business Administration and Accountancy, Brazil; Department of Business Administration, University of São Paulo, School of Economics, Business Administration and Accountancy (FEA/USP), Brazil|English|
Journal Article|article|85|Higgins JC|Decision-Making at Board Level Using Decision Analysis: Two Case Studies|Journal of the Operational Research Society|Q1|120|1982|33|4|319-326|||1982|||0160-5682|http://dx.doi.org/10.1057/jors.1982.73|10.1057/jors.1982.73|Two cases are described: the first in a newspaper publishing company concerned a strategic pricing decision; the second involved a property litigation problem in a food retailing company. Neither of the decision analysis models presented to the respective Boards of Directors was at all complex mathematically but they were highly influential on the decision-making processes. Indeed both were critical to the decisions made at those times. Some possible lessons are drawn from the cases with respect to these types of decision-making process, the type and complexity of model appropriate and information problems. © 1982 Operational Research Society Ltd.|OPERATIONS RESEARCH, DECISION THEORY AND ANALYSIS|cited By 1|University of Bradford Management Centre, United Kingdom|English|
Journal Article|article|86|Renz DO,Brown WA,Andersson FO|The Evolution of Nonprofit Governance Research: Reflections, Insights, and Next Steps|Nonprofit and Voluntary Sector Quarterly|Q1|96|2023|52|1_suppl|241S-277S|SAGE Publications Inc.||2023|||0899-7640|http://dx.doi.org/10.1177/08997640221111011|10.1177/08997640221111011|The literature on nonprofit governance and boards has grown substantially during the past 50 years as researchers from a variety of disciplines and fields have studied governance systems and processes to examine how they are organized, the practices they employ, and their relations with and impacts on nonprofits. This essay offers a domain-based narrative review of the research on the governance of nonprofit organizations and how it has developed over these 50 years. Building on literature reviews and a Delphi study, we summarize the progression of nonprofit governance research, employ a multi- dimensional framework to summarize and assess the state of the field, and offer recommendations for future study. We find the increasingly multinational and multicultural literature of the field has become more rich, nuanced, and increasingly inclusive of contingency, complexity, paradox, and the diverse theoretical perspectives that will enhance our understanding of nonprofit governance. © The Author(s) 2022.||cited By 0|University of Missouri–Kansas City, United States; Texas A&M University, College Station, United States; Indiana University–Purdue University Indianapolis, United States|English|
