Item type|ENTRYTYPE|ID|Authors|Title|Journal|quartil|hindex|Publication year|Volume|Issue|Pages|Publisher|Address|Date published|ISBN|ISBN (alt.)|ISSN|URLs|DOI|Abstract|Keywords|Notes|Affiliation|Language|Pages cited
Journal Article|article|119|Chychyla R,Leone AJ,Minutti- Meza M|Complexity of financial reporting standards and accounting expertise|JOURNAL OF ACCOUNTING & ECONOMICS|Q1|174|2019|67|1|226-253|ELSEVIER SCIENCE BV|PO BOX 211, 1000 AE AMSTERDAM, NETHERLANDS|2019-02|||0165-4101|http://dx.doi.org/10.1016/j.jacceco.2018.09.005|10.1016/j.jacceco.2018.09.005|This study tests whether firms seek to mitigate the adverse effects of Financial Reporting Complexity (FRC) by investing in accounting expertise. We develop a measure of FRC based on the complexity of accounting standards that govern annual disclosures. We find that FRC is positively related to the accounting expertise on a firm's board of directors and audit committee. We also find that accounting expertise mitigates the relation between FRC and negative reporting outcomes. Collectively, this study increases our understanding of the actions firms take to mitigate the negative consequences of FRC, and the role of accounting expertise in this setting.|Financial reporting complexity; Accounting expertise; Financial reporting quality; Textual analysis; XBRL||Leone, AJ (Corresponding Author), Kellogg Sch Management, Dept Accounting & Informat Management, Evanston, IL 60208 USA. Chychyla, Roman; Minutti- Meza, Miguel, Univ Miami, Miami Business Sch, Coral Gables, FL 33146 USA. Leone, Andrew J., Northwestern Univ, Kellogg Sch Management, Evanston, IL USA.|English|
Journal Article|article|120|Alajmi A,Worthington AC|Corporate governance in Kuwait: joining the dots between regulatory reform, organisational change in boards and audit committees and firm market and accounting performance|JOURNAL OF FINANCIAL REPORTING AND ACCOUNTING|Q2|16|||||EMERALD GROUP PUBLISHING LTD|HOWARD HOUSE, WAGON LANE, BINGLEY BD16 1WA, W YORKSHIRE, ENGLAND||||1985-2517|http://dx.doi.org/10.1108/JFRA-04-2022-0133|10.1108/JFRA-04-2022-0133|PurposeThis study aims to examine the link between boards and audit committees and firm performance in Kuwaiti listed firms in the context of recent and extensive corporate governance regulatory reform. Design/methodology/approachPanel data regression analysis with fixed effects and clustered standard errors of firm performance for 61-97 listed industrial and services firms in Kuwait over a seven-year period. The dependent variables are the returns on assets and equity, the debt-to-equity ratio and leverage and Tobin's Q and the independent variables comprise board of directors and audit committee characteristics, including size, the number of meetings and the numbers of independent and outside board and expert committee members. Firm size, subsidiary status and cash flow serve as control variables. FindingsMixed results with respect to the characteristics of the board of directors. Board size and independent and outsider board members positively relate only to Tobin's Q and insiders only to debt to equity. For audit committee characteristics, committee size, independence and expertise positively relate to the return on equity and committee size and expertise only to Tobin's Q. Of the five performance measures considered, board and audit committee characteristics together best determine Tobin's Q. Research limitations/implicationsData from a single country limits generalisability and control variables necessarily limited in a developing market context. Need for qualitative insights into corporate governance reform as a complement to conventional quantitative analysis. In combining accounting and market information, Tobin's Q appears best able to recognise the performance benefits of good corporate governance in terms of internal organisational change. Practical implicationsThe recent corporate governance code and guidelines reforms exert a mixed impact on firm performance, with audit committees, not boards, of most influence. But recent reforms implied most change to boards of directors. One suggestion is that non- market reform may have been unneeded given existing market pressure on listed firms and firms anticipating regulatory change. Social implicationsKuwait's corporate governance reforms codified corporate governance practices already in place among many of its firms in pursuit of organisational legitimacy, and while invoking substantial change to audit committees, involved minor change to firm performance, at least in the short term. Some firms may also have delisted in expectation of stronger corporate governance requirements. Regardless, these direct and indirect processes both improved the overall quality of listed firm corporate governance and performance in Kuwait. Originality/valueSeminal analysis of corporate governance reforms in Kuwait, which have rapidly progressed from no corporate governance code and guidelines to an initially voluntary and then compulsory regime. Only known analysis to incorporate both board of directors and audit committee characteristics. Reveals studies of the corporate governance-firm performance relationship may face difficulty in model specification, and empirical significance, given the complexity of corporate governance codes and guidelines, leads in changing firm behaviour and self-selection of firms into and out of regulated markets.|Corporate governance; Audit committees; Boards of directors; Emerging markets; Market and accounting performance; Kuwait||Alajmi, A (Corresponding Author), Publ Author Appl Educ & Training, Dept Accounting Finance & Econ, Kuwait, Kuwait. Alajmi, Abdullah, Publ Author Appl Educ & Training, Dept Accounting Finance & Econ, Kuwait, Kuwait. Worthington, Andrew C., Griffith Univ, Brisbane, Australia.|English|
Journal Article|article|121|Alawaqleh QA,Almasria NA,Alsawalhah JM|The Effect of Board of Directors and CEO on Audit Quality: Evidence from Listed Manufacturing Firms in Jordan|JOURNAL OF ASIAN FINANCE ECONOMICS AND BUSINESS|Not yet assigned quartile|25|2021|8|2|243-253|KOREA DISTRIBUTION SCIENCE ASSOC|HANSHIN OFFICETEL STE 1030, 2463-4, SHINHEUNG-DONG SUJEONG-GU, SEONGNAM, GYEONGGI, 461-713, SOUTH KOREA|2021-02|||2288-4637|http://dx.doi.org/10.13106/jafeb.2021.vol8.no2.0243|10.13106/jafeb.2021.vol8.no2.0243|This study aims to examine (1) the association between the chief executive officer tenure and audit quality, (2) the relationship between chief executive officer duality and audit quality, (3) the association between board independence and audit quality, (4) the relationship between board size and audit quality, and (5) the role of controlling variables (client size, leverage debt, and business complexity) in controlling these relationships. The research sample includes 325 financial reports from manufacturing firms listed in Amman Stock exchange over the 20142018 period. The study relationships are tested by using logistic regression. The results revealed a negative relationship, but not significant between CEO tenure and independent directors with audit quality. In addition, the results showed there is a negative effect of CEO duality on audit quality; also the results revealed that there is a statistically significant effect on the board of directors (board size) on the AQ. In general, the coefficient estimates of controlling variables show that client size and leverage debt positively affect audit quality, and on the contrary, business complexity has an insignificant positive relationship with audit quality. The summary of the study findings play an active role to external auditor opinion on business practice in towered the corporate governance system.|Audit Quality; Corporate Governance; Chief Executive Officer Tenure; Chief Executive Officer Duality; Board Independence; Board Size||Alawaqleh, QA (Corresponding Author), Philadelphia Univ, Coll Business, Accounting Dept, Amman, Jordan. Alawaqleh, Qasim Ahmad; Almasria, Nashat Ali; Alsawalhah, Jafer Maroof, Philadelphia Univ, Coll Business, Accounting Dept, Amman, Jordan.|English|
Journal Article|article|122|Ndofor HA,Wesley C,Priem RL|Providing CEOs With Opportunities to Cheat: The Effects of Complexity-Based Information Asymmetries on Financial Reporting Fraud|JOURNAL OF MANAGEMENT|Q1|261|2015|41|6|1774-1797|SAGE PUBLICATIONS INC|2455 TELLER RD, THOUSAND OAKS, CA 91320 USA|2015-09|||0149-2063|http://dx.doi.org/10.1177/0149206312471395|10.1177/0149206312471395|Opportunities for financial reporting fraud arise because of information asymmetriesoften labeled lack of transparencybetween top managers and their diverse shareholders. We evaluate the relative contributions of information asymmetries arising from industry-level and firm-level complexities to the likelihood of top managers committing financial reporting fraud. Using a sample of 453 matched pairs of firms that have and have not been identified as having committed financial reporting fraud, we found that information asymmetries arising from industry- and firm-level complexities increase the likelihood of financial fraud. Moreover, more CEO stock options increase the likelihood of fraud when industry complexity is high, while aggressive monitoring by the audit committee reduces the likelihood of reporting fraud when firm-level complexity is high.|agency theory; compensation; bonuses and benefits; boards of directors||Ndofor, HA (Corresponding Author), Texas A&M Univ, Dept Management, Mays Business Sch, College Stn, TX 77843 USA. Ndofor, Hermann Achidi, Texas A&M Univ, College Stn, TX 77843 USA. Wesley, Curtis, Indiana Univ, Bloomington, IN 47405 USA. Priem, Richard L., Texas Christian Univ, Ft Worth, TX 76129 USA. Priem, Richard L., LUISS Guido Carli Univ, Rome, Italy.|English|
Journal Article|article|123|Amran A,Lee SP,Devi SS|The Influence of Governance Structure and Strategic Corporate Social Responsibility Toward Sustainability Reporting Quality|BUSINESS STRATEGY AND THE ENVIRONMENT|Q1|131|2014|23|4|217-235|WILEY|111 RIVER ST, HOBOKEN 07030-5774, NJ USA|2014-05|||0964-4733|http://dx.doi.org/10.1002/bse.1767|10.1002/bse.1767|Increased business complexities coupled with enhanced global transformation have propelled corporations to behave as responsible citizens to drive the sustainability agenda. Many corporations incorporate their affirmative commitment to sustainable business practices into their corporate identities and give evidence for this in their sustainability reports. This paper examines the role of the board of directors in sustainability reporting quality (SRQ) in the Asia-Pacific region. Based on a cross-sectional study of 113 companies from 12 countries in the region, we find that the SRQ in the region leaves much room for improvement. However, we find that the institutionalization of the concept of corporate social responsibility (CSR) in an organization provides a sound foundation for enhancing SRQ. We find that the value of CSR anchored in the vision and/or mission statement and strategic alliances fostered with non-governmental organizations are positively associated with SRQ. This study contributes to strengthening the understanding, promoting discussion on the state of sustainability reporting in the Asia-Pacific context and laying a solid foundation for more aggressive efforts to enhance SRQ. The study identifies the significant drivers currently associated with SRQ. The weak role of the board of directors in upholding the sustainable development agenda through the reporting process is highlighted. Copyright (C) 2013 John Wiley & Sons, Ltd and ERP Environment.|sustainability reporting; board of directors; strategic CSR; Asia Pacific||Amran, A (Corresponding Author), Univ Sains Malaysia, Sch Management, Minden Penang 11800, Minden, Malaysia. Amran, Azlan; Lee, Shiau Ping, Univ Sains Malaysia, Sch Management, Minden Penang 11800, Minden, Malaysia. Devi, S. Susela, Univ Malaya, Fac Business & Accountancy, Kuala Lumpur, Malaysia.|English|
Journal Article|article|124|Klijn E,Reuer JJ,Volberda HW,van den Bosch FA|Ex-post governance in joint ventures: Determinants of monitoring by JV boards of directors|LONG RANGE PLANNING|Q1|118|2019|52|1|72-85|ELSEVIER SCI LTD|THE BOULEVARD, LANGFORD LANE, KIDLINGTON, OXFORD OX5 1GB, OXON, ENGLAND|2019-02|||0024-6301|http://dx.doi.org/10.1016/j.lrp.2017.10.006|10.1016/j.lrp.2017.10.006|Considerable advances have been made in corporate governance research in recent years and opportunities exist to consider these developments within alliances. We extend the ``scope of operations'' hypothesis to the domain of joint ventures. This proposition suggests that the monitoring carried out by boards increases when organizations become more complex. The inherent characteristics of JVs generate unique sources of complexity that are currently unexplored in the corporate governance literature. First, we seek to determine their influence on monitoring by using primary data on JV board monitoring. Second, we adopt the size of JV boards as a proxy for monitoring in order to examine whether the determinants of board size and monitoring in fact coincide and to reveal if certain effects are masked by using board size as a simple proxy for monitoring. Doing so enables us to investigate the black-box of what boards actually do as well as extend governance research to other organizational forms. Our findings confirm that the unique characteristics of JVs influence the information needs by the boards resulting in more monitoring by JV directors. Our findings show there is value in bridging alliance theory and the literature on corporate governance research. We also advance practitioner's understanding by providing suggestions on how to structure JV boards in relation to their complexity. (C) 2017 Elsevier Ltd. All rights reserved.|||Klijn, E (Corresponding Author), Old Dominion Univ, Strome Coll Business, 2004 Constant Hall, Norolk, VA 23529 USA. Klijn, Elko, Old Dominion Univ, Strome Coll Business, 2004 Constant Hall, Norolk, VA 23529 USA. Reuer, Jeffrey J., Univ Colorado, Leeds Sch Business, Boulder, CO 80309 USA. Volberda, Henk W.; van den Bosch, Frans A. J., Erasmus Univ, Rotterdam Sch Management, NL-3062 PA Rotterdam, Netherlands.|English|
Journal Article|article|125|Acero Fraile I,Alcalde Fradejas N|The effect of the monitoring function and advisory function on board structure|REVISTA ESPANOLA DE FINANCIACION Y CONTABILIDAD- SPANISH JOURNAL OF FINANCE AND ACCOUNTING|Q3|20|2012|41|153|9-38|ROUTLEDGE JOURNALS, TAYLOR & FRANCIS LTD|2-4 PARK SQUARE, MILTON PARK, ABINGDON OX14 4RN, OXON, ENGLAND|JAN-MAR 2012|||0210-2412|||This paper analyses board size and composition determinants with reference to boards' two principal functions: the control or monitoring function and the advisory function. It also tackles the endogeneity problem which exists in this type of studies. Using a sample composed of 171 publically traded Spanish corporations spanning the period 2004-2008, the results show that, in Spain, board size is sensitive to advisory needs (using firm complexity as a proxy for them), while board composition depends to a greater extent on the need for control, determined by the organization's stock structure. The evidence shows that the presence of independent members on the boards of directors in Spain basically responds the objective of guaranteeing an adequate representation of the ownership structure of the company rather than in response to a specific need for counselling.|Advisory and monitoring function; Corporate governance; Endogeneity; Ownership concentration; Spain; Structure of the board of directors||Fraile, IA (Corresponding Author), Fac Econ & Empresa, Dept Direcc & Org Empresas, Campus Rio Ebro,Maria de Luna S-N,Edificio Lorenz, Zaragoza 50018, Spain. Acero Fraile, Isabel; Alcalde Fradejas, Nuria, Univ Zaragoza, E-50009 Zaragoza, Spain.|English|
Journal Article|article|126|Debellis F,De Massis A,Petruzzelli AM,Frattini F,Del Giudice M|Strategic agility and international joint ventures: The willingness-ability paradox of family firms|JOURNAL OF INTERNATIONAL MANAGEMENT|Q1|80|2021|27|1||ELSEVIER|RADARWEG 29, 1043 NX AMSTERDAM, NETHERLANDS|2021-03|||1075-4253|http://dx.doi.org/10.1016/j.intman.2020.100739|10.1016/j.intman.2020.100739|Despite the considerable increase in studies on international joint ventures (IJVs) and family business, the two research streams have yet to be systemically integrated. Family firms have unique characteristics that affect their involvement in IJVs differently from their non-family counterparts. Indeed, family firms face a paradox entailing a lower willingness to form IJVs, but a higher ability to govern them. Drawing on three distinct components of strategic agility (i.e., strategic sensitivity, leadership unity, and resource fluidity), we develop a theoretical framework that unravels this paradox. Specifically, we argue that strong emotional attachment reduces family firms? strategic sensitivity, creating a motivational gap with respect to forming IJVs. On the other hand, when family firms overcome this gap by making full use of their board of directors, they have higher levels of leadership unity and resource fluidity. These dimensions lead to a greater ability to govern the complexities of the relationship, hence reducing opportunistic hazards, and significantly increasing the odds of the long-term success of IJVs. We develop propositions for empirical studies, and offer implications and directions for future research.|International joint ventures; Strategic agility; Family firms; Board of directors; Socioemotional wealth||Debellis, F (Corresponding Author), Free Univ Bozen Bolzano, Fac Econ & Management, Ctr Family Business Management, Piazza Univ 1, I-39100 Bozen Bolzano, Italy. Debellis, Francesco; De Massis, Alfredo, Free Univ Bozen Bolzano, Fac Econ & Management, Ctr Family Business Management, Piazza Univ 1, I-39100 Bozen Bolzano, Italy. De Massis, Alfredo, Univ Lancaster, Lancaster, England. Petruzzelli, Antonio Messeni, Politecn Bari, Via Orabona 4, I-70126 Bari, Italy. Frattini, Federico, Politecn Milan, Sch Management, Via Lambruschini 4-B, I-20156 Milan, Italy. Del Giudice, Manlio, Univ Rome, Link Campus Univ, Via Casale S Pio V 44, I-00165 Rome, Italy. Del Giudice, Manlio, Paris Sch Business, Rue Natl, Paris, France. Del Giudice, Manlio, Natl Res Univ Higher Sch Econ, Moscow, Russia.|English|
Journal Article|article|127|Trinh VQ,Aljughaiman AA,Cao ND|Fetching better deals from creditors: Board busyness, agency relationships and the bank cost of debt|INTERNATIONAL REVIEW OF FINANCIAL ANALYSIS|Q1|79|2020|69|||ELSEVIER SCIENCE INC|STE 800, 230 PARK AVE, NEW YORK, NY 10169 USA|2020-05|||1057-5219|http://dx.doi.org/10.1016/j.irfa.2020.101472|10.1016/j.irfa.2020.101472|In a cross-country setting, we document that busy boards of directors (i.e., outside directors with multiple directorships) enhance a bank's financing capacity by lowering its cost of debt, which is consistent with the signalling quality hypothesis. Our analysis further reveals that this negative association is more pronounced in conventional banks than their Islamic counterparts. Possibly owning to the distinctive governance structure and the complexity of the Islamic business model, which requires closer monitoring, Muslim debtholders might depreciate a busy board of directors as it is likely to associate with lower scrutinising effectiveness. Our results provide a positive counterpoint to the negative relationship that exists between busy directors and firm performance, and contributes to understanding the indispensable role busy boards play in debt financing.|Board busyness; Islamic banks; Conventional banks; Cost of debt||Trinh, VQ (Corresponding Author), Univ Huddersfield, Huddersfield Business Sch, Huddersfield HD1 3DH, W Yorkshire, England. Trinh, Vu Quang, Univ Huddersfield, Huddersfield Business Sch, Huddersfield HD1 3DH, W Yorkshire, England. Aljughaiman, Abdullah A., King Faisal Univ, Sch Business, Al Hasa, Saudi Arabia. Cao, Ngan Duong, Univ Bath, Sch Management, Bath, Avon, England. Cao, Ngan Duong, Claverton Rd, Bath BA2 7AY, Avon, England.|English|
Journal Article|article|128|Cuadrado-Ballesteros B,Martinez-Ferrero J,Garcia-Sanchez IM|Board Structure to Enhance Social Responsibility Development: A Qualitative Comparative Analysis of US Companies|CORPORATE SOCIAL RESPONSIBILITY AND ENVIRONMENTAL MANAGEMENT|Q1|96|2017|24|6|524-542|WILEY|111 RIVER ST, HOBOKEN 07030-5774, NJ USA|NOV-DEC 2017|||1535-3958|http://dx.doi.org/10.1002/csr.1425|10.1002/csr.1425|This study adds clarity to inconclusive results in previous literature about the link between board characteristics and the level of social responsibility performance by using fuzzy set qualitative comparative analysis. Specifically, we propose a new holistic framework based on the complexity theory. From a sample of 471 non- financial companies from the USA for the period 2008-2010, our findings support the four tenets of complexity theory: equifinality, complexity, asymmetry, and causal asymmetry. More concretely, they suggest that CSR performance depends on a complex configuration of some board characteristics, such as size, independency, diversity and activity, and other corporate attributes (i.e., company size, leverage, and growth opportunities). These factors play a key role as the ingredients of the recipe and, in a proper combination, contribute to obtaining high levels of social responsibility performance. Copyright (c) 2017 John Wiley & Sons, Ltd and ERP Environment|corporate social responsibility; stakeholder engagement; qualitative comparative analysis; complexity theory; board of directors; sustainability development; social responsibility||Cuadrado-Ballesteros, B (Corresponding Author), Univ Salamanca, Adm & Business Econ, Multidisciplinary Inst Enterprise IME, FES, Campus Unamuno, Salamanca 37007, Spain. Cuadrado-Ballesteros, Beatriz; Martinez-Ferrero, Jennifer; Garcia-Sanchez, Isabel M., Univ Salamanca, Adm & Business Econ, Multidisciplinary Inst Enterprise IME, FES, Campus Unamuno, Salamanca 37007, Spain.|English|
Journal Article|article|129|Chen LY,Lai JH|The effect of board human capital on the performance of technical alliance investments|R & D MANAGEMENT|Q1|112|2017|47|2|265-276|WILEY|111 RIVER ST, HOBOKEN 07030-5774, NJ USA|2017-03|||0033-6807|||Despite boards of directors' prominent involvement in strategic alliance ( SA) decisions in practice and reports from news media, there is relatively little academic research exploring the board's value for a firm's technical SA investments involving a technical transfer or R & D, which are characterized by a high level of uncertainty, information asymmetry, and extreme complexity. Anchored in the resource dependence theory, this study aims to address this important issue by examining how board of directors contribute their human capital, in the form of relevant strategic experience, may mitigate the core challenges managers face when pursuing technical SAs and thereby influencing their outcomes. Our empirical results show that when outside directors hold more extensive alliance experience, they can better execute their consulting function and improve the firm's technical alliance performance. In addition, directors with experience specifically related to technical alliances also have a positive effect on performance. Last, we find that the impact of alliance experience on technical alliance performance is positively moderated by the size of directors' prior affiliated companies and their share ownership in the focal firm.|||Chen, LY (Corresponding Author), Soochow Univ, Dept Business Adm, 56,Kueiyang St,Sect 1, Taipei 100, Taiwan. Chen, Li-Yu, Soochow Univ, Dept Business Adm, 56,Kueiyang St,Sect 1, Taipei 100, Taiwan. Lai, Jung-Ho, Natl Taipei Univ Business, Dept Finance, 321,Sec 1,Jinan Rd, Taipei 10051, Taiwan.|English|
